{
  "worker_id": "f4bb2eb4-3781-4a84-b9c6-67fe71ef31ef",
  "currency": "inr",
  "as_of": "2026-04-04T18:11:20Z",
  "items": [
    {
      "payout_id": "f264680b-1e3b-4e5f-96b5-9f59c47f95fb",
      "claim_id": "9fcd35f5-0cec-4207-bfa7-1f7f7df13f9f",
      "event_id": "2f2f67c3-6f9c-40a1-89d0-2fef2ea88f1e",
      "amount": 360,
      "status": "credited",
      "decision": "auto_approve",
      "created_at": "2026-04-04T18:11:10Z",
      "processed_at": "2026-04-04T18:11:18Z"
    },
    {
      "payout_id": "af3597bc-5493-4f82-a9f5-63ec1a50a4f5",
      "claim_id": "319d0ea2-f4f6-4196-a407-0c808d21b54d",
      "event_id": "2f2f67c3-6f9c-40a1-89d0-2fef2ea88f1e",
      "amount": 280,
      "status": "held",
      "decision": "partial_hold",
      "created_at": "2026-04-04T18:11:10Z",
      "processed_at": null,
      "failure_reason": "awaiting_secondary_review"
    }
  ]
}
